151,Odpady,Kovy,Markéta Pézlová,Doba železná,Žák popíše rozdíly ve způsobu výroby železa dnes a v minulosti.,,,"Jak by vypadalo setkání zpracovatele kovu z dob dávno minulých s našimi současníky? Zahrajte divadlo, napište sloh.",,První stupeň ZŠ,Druhý stupeň ZŠ,SŠ,,,,,4. třída ZŠ,5. třída ZŠ,6. třída ZŠ,7. třída ZŠ,8. třída ZŠ,9. třída ZŠ,SŠ,čeština,,,,,ekologie,,,,vlastivěda,,,,Odpady,,,,,,,,,,,,,,EVVO ve výuce,,,30 min,Uvnitř,,1,2,doba_elezn.pdf, ,,2020-01-08 11:18:33,public,,,194.228.11.48,1,1,https://petra2018.wufoo.com/cabinet/c286074f-6523-4542-92ff-e065b9754ac2
152,Odpady,Kovy,Markéta Pézlová,Těžba rudy,"Žák vyhledá v mapě ČR oblasti, kde se těží železná ruda.","Žák vyhledá v mapě ČR oblasti, kde se vyrábí železo a ocel.",Žák podle obrázku popíše vliv těžby a zpracování železa na ráz krajiny.,Kde se v ČR těží železná ruda a kde vyrábí železo? A jak vypadá tamní krajina? Práce s mapou a dalšími informačními zdroji.,,První stupeň ZŠ,Druhý stupeň ZŠ,SŠ,,,,,4. třída ZŠ,5. třída ZŠ,6. třída ZŠ,7. třída ZŠ,8. třída ZŠ,9. třída ZŠ,SŠ,,,,,,ekologie,,,,vlastivěda,,,zeměpis,Odpady,,,,,,,,,,,,,,EVVO ve výuce,,,10 min,Uvnitř,,1,1,tba_rudy.pdf, ,,2020-01-08 12:23:18,public,,,194.228.11.48,1,1,https://petra2018.wufoo.com/cabinet/4fbcc1f6-7642-4bb5-ad32-c976a19880c4
153,Odpady,Nápojové kartony,Markéta Pézlová,Nápojové kartony,Žák se seznámí se složením nápojových kartonů a možnostmi jejich recyklace. ,,,"Podívejme se pod sukni nápojovým kartonům. Z čeho jsou vyrobeny a jak na jejich recyklaci? Vyzkoušejte, jak z nich vyrobit něco užitečného nebo jak je efektivně poskládat do popelnice.",,První stupeň ZŠ,Druhý stupeň ZŠ,,,,2. třída ZŠ,3. třída ZŠ,4. třída ZŠ,5. třída ZŠ,6. třída ZŠ,7. třída ZŠ,8. třída ZŠ,9. třída ZŠ,,,,,,,ekologie,,,prvouka,,,,,Odpady,,,,,,,,,,,,,,EVVO ve výuce,,,45 min,Uvnitř,,1,3,napojove_karotony_metodika_1.pdf, ,,2020-01-08 12:52:10,public,,,194.228.11.48,1,1,https://petra2018.wufoo.com/cabinet/f489252f-c09a-4279-b9f5-67ebdd2d303b
154,Odpady,Nápojové kartony,Markéta Pézlová,Naplníme popelnici?,"Žák hledá efektivní způsob, jak ukládat nápojové kartony do popelnice.",,,Komu se povede do popelnice naskládat nejvíc nápojových kartonů najednou?,MŠ,První stupeň ZŠ,,,MŠ,1. třída ZŠ,2. třída ZŠ,3. třída ZŠ,4. třída ZŠ,5. třída ZŠ,,,,,,,,,,,ekologie,,,prvouka,,,,,Odpady,,,,,,,,,,,,,,EVVO ve výuce,,,10 min,Uvnitř,Venku,1,3,naplnme_popelnici_.pdf, ,,2020-01-08 13:03:52,public,,,194.228.11.48,1,1,https://petra2018.wufoo.com/cabinet/fa376a03-c3b0-46ee-a91b-c2cd22c8b633
155,Odpady,Nápojové kartony,Markéta Pézlová,Lampiony,Žák vyrobí lampion z prázdného nápojového kartonu.,,,Návod jak z prázdného nápojového kartonu vyrobit jednoduchý lampion.,MŠ,První stupeň ZŠ,Druhý stupeň ZŠ,SŠ,MŠ,1. třída ZŠ,2. třída ZŠ,3. třída ZŠ,4. třída ZŠ,5. třída ZŠ,6. třída ZŠ,7. třída ZŠ,8. třída ZŠ,9. třída ZŠ,SŠ,,,,,,ekologie,,,,,,,,Odpady,,,,,,,,,,,,,,EVVO ve výuce,,,30 min,Uvnitř,,1,3,lampiony.pdf, ,Vhodné také pro výtvarnou výchovu a pracovní činnosti.,2020-01-08 13:18:10,public,,,194.228.11.48,1,1,https://petra2018.wufoo.com/cabinet/33a229db-b662-49c7-9bb7-db063ff22ddf
156,Odpady,Nápojové kartony,Markéta Pézlová,Pitva,Žák na základě vlastního zkoumání popíše složení nápojového kartonu.,Žák provádí různá fyzikální měření.,Žák vyvodí z pozorování jednoduché závěry.,"Žáci samostatně ""pitvají"" prázdné nápojové kartony.  Dále vyvozují  závěry o jejich složení, funkci jednotlivých vrstev a možnostech recyklace. Aktivitu je možné obohatit o další fyzikální měření, výpočet hustoty apod.",,První stupeň ZŠ,Druhý stupeň ZŠ,SŠ,,,,,4. třída ZŠ,5. třída ZŠ,6. třída ZŠ,7. třída ZŠ,8. třída ZŠ,9. třída ZŠ,SŠ,,,,,,ekologie,,chemie,,,přírodověda,fyzika,,Odpady,,,,,,,,,,,,,,EVVO ve výuce,,,30 min,Uvnitř,,1,3,pitva.pdf, ,,2020-01-08 13:35:51,public,,,194.228.11.48,1,1,https://petra2018.wufoo.com/cabinet/aba6219c-ba9b-46ec-87ea-b3c54ca54499
157,Odpady,Nebezpečné odpady,Markéta Pézlová,Nebezpečné odpady,Žák se seznámí s druhy nebezpečných odpadů a nakládání s nimi.,"Žák zjistí, kam je v obci možné odkládat nebezpečný odpad.",Žák přiřadí piktogramy z nebezpečných odpadů k jejich popisu.,Pracovní list seznámí žáky s jednotlivými druhy nebezpečných odpadů a pomůže jim zorientovat se v symbolech nebezpečných vlastností.,,,Druhý stupeň ZŠ,SŠ,,,,,,,,,8. třída ZŠ,9. třída ZŠ,SŠ,,,,,,ekologie,,chemie,,,,,,Odpady,,,,,,,,,,,,,,EVVO ve výuce,,,30 min,Uvnitř,,1,1,nebezpecny_odpad_metodika.pdf,nebezpan_odpad_pl.pdf,,2020-01-08 13:54:22,public,,,194.228.11.48,1,1,https://petra2018.wufoo.com/cabinet/9529aeb8-574c-4088-8672-ff235cc585c0
158,Odpady,Obaly,Markéta Pézlová,Co nám poví obal,Žák se orientuje ve značkách na obalech.,,,Co všechno zjistíme ze značek na obalech? Aktivita obsahuje pracovní list.,,První stupeň ZŠ,Druhý stupeň ZŠ,SŠ,,,,3. třída ZŠ,4. třída ZŠ,5. třída ZŠ,6. třída ZŠ,7. třída ZŠ,8. třída ZŠ,9. třída ZŠ,SŠ,,,,,,ekologie,občanská výchova,,prvouka,vlastivěda,,,,Odpady,,,,,,,,,,,,,,EVVO ve výuce,,,10 min,Uvnitř,,1,1,obaly_metodika_1.pdf,obaly_co_nam_povi_obal_pl_1.pdf,V metodice i na pracovním listu jsem nahradila staré logo značky Czech made.,2020-01-08 14:25:09,public,,,194.228.11.48,1,1,https://petra2018.wufoo.com/cabinet/c28889fd-a582-4af3-b486-57538e6c2012
159,Odpady,Obaly,Markéta Pézlová,Historie obalů,"Žák popíše, jaké obaly se používaly v minulosti a dnes.",,,"Aktivita přináší zajímavosti o obalech, např. odpověď na otázku: Jak se nakupovalo bez plastových sáčků? Žáci mají možnost se podrobněji seznámit s historií různých typů obalů. Součástí je pracovní list.",,První stupeň ZŠ,Druhý stupeň ZŠ,SŠ,,,,,,5. třída ZŠ,6. třída ZŠ,7. třída ZŠ,8. třída ZŠ,9. třída ZŠ,SŠ,,,,,,ekologie,občanská výchova,,,vlastivěda,,,,Odpady,,,,,,,,,,,,,,EVVO ve výuce,,,30 min,Uvnitř,,1,1,obaly_metodika_2.pdf,obaly_pl.pdf,,2020-01-08 17:20:38,public,,,194.228.11.48,1,1,https://petra2018.wufoo.com/cabinet/6c30969a-28fe-4ffd-a67c-8d5e92fc0829
160,Odpady,Obaly,Markéta Pézlová,Obaly,Žák se orientuje ve značkách na obalech.,Žák podle značek rozezná různé druhy obalů.,,Aktivita vyzývá k dlouhodobějšímu zájmu o obaly. Postupně vzniká sbírka různých typů obalů.,,První stupeň ZŠ,Druhý stupeň ZŠ,SŠ,,,2. třída ZŠ,3. třída ZŠ,4. třída ZŠ,5. třída ZŠ,6. třída ZŠ,7. třída ZŠ,8. třída ZŠ,9. třída ZŠ,SŠ,,,,,,ekologie,,,prvouka,,,,,Odpady,,,,,,,,,,,,,,EVVO ve výuce,,,projekt,Uvnitř,,1,1,obaly_metodika_3.pdf, ,,2020-01-08 17:39:12,public,,,194.228.11.48,1,1,https://petra2018.wufoo.com/cabinet/d12f51fb-ecea-441d-8055-039d49a864cf
161,Odpady,Papír,Markéta Pézlová,Historie výroby papíru,Žák se seznámí s historií výroby papíru.,,,Pracovní list seznamuje žáky s různými postupy výroby papíru v historii v různých částech světa.,,,Druhý stupeň ZŠ,SŠ,,,,,,,6. třída ZŠ,7. třída ZŠ,8. třída ZŠ,9. třída ZŠ,SŠ,,,,,,ekologie,,,,,,,,Odpady,,,,,,,,,,,,,,EVVO ve výuce,,,10 min,Uvnitř,,1,1,historie_papru_metodika_1.pdf,papr_pl_1.pdf,Vhodné také pro dějepis.,2020-01-08 20:13:05,public,,,194.228.11.48,1,1,https://petra2018.wufoo.com/cabinet/f9c0e8b3-b797-4fc5-a9c2-333645fb2e2f
162,Odpady,Předcházení vzniku odpadu,Markéta Pézlová,Předcházení vzniku odpadu,"Přivést žáky k zamyšlení se nad naším způsobem života a jeho dopady, vést je k chováníšetrnému k životnímu prostředí a přijít na způsoby jak omezovat vznik zbytečného odpadu. ",,,"Materiál nabízí několik aktivit, které žáky vedou k zamyšlení se nad možnosti, jak vzniku odpadu předcházet. ",,První stupeň ZŠ,Druhý stupeň ZŠ,SŠ,,,2. třída ZŠ,3. třída ZŠ,4. třída ZŠ,5. třída ZŠ,6. třída ZŠ,7. třída ZŠ,8. třída ZŠ,9. třída ZŠ,SŠ,,,,přírodopis,,ekologie,,,prvouka,,přírodověda,,,Odpady,,,,,,,,,,,,,,EVVO ve výuce,,,projekt,Uvnitř,,1,1,predchazeni_vzniku_odpadu_metodika.pdf, ,,2020-01-08 21:14:14,public,,,194.228.11.48,1,1,https://petra2018.wufoo.com/cabinet/00349cca-ca62-4729-a8c0-51ac87df250e
163,Odpady,Předcházení vzniku odpadu,Markéta Pézlová,Odpadový kodex,"Žák navrhne pět způsobů, jak snížit množství odpadu.",,,"Žáci sami navrhují způsoby, jak snížit množství odpadu. Metodou sněhové koule vyberou pětici zásad pro třídu. ",,První stupeň ZŠ,Druhý stupeň ZŠ,SŠ,,,,3. třída ZŠ,4. třída ZŠ,5. třída ZŠ,6. třída ZŠ,7. třída ZŠ,8. třída ZŠ,9. třída ZŠ,SŠ,,,,přírodopis,,ekologie,,,prvouka,,přírodověda,,,Odpady,,,,,,,,,,,,,,,,Ekokodex,30 min,Uvnitř,,1,3,odpadov_kodex.pdf, ,,2020-01-08 21:36:55,public,,,194.228.11.48,1,1,https://petra2018.wufoo.com/cabinet/e73d914b-17f0-499e-88cb-910d45830331
164,Odpady,Plasty,Markéta Pézlová,Život mikrotenové tašky,"Žák popíše ""život"" mikrotenové tašky.",,,"Obrázkové kartičky sledují život mikrotenové tašky od výroby k rozpadu. Kartičky nabízí více variant použití. Žáci je mohou řadit do posloupnosti, hrát s nimi hry ve skupinách.",MŠ,První stupeň ZŠ,Druhý stupeň ZŠ,SŠ,MŠ,1. třída ZŠ,2. třída ZŠ,3. třída ZŠ,4. třída ZŠ,5. třída ZŠ,6. třída ZŠ,7. třída ZŠ,8. třída ZŠ,9. třída ZŠ,SŠ,čeština,,,přírodopis,,ekologie,,,prvouka,,přírodověda,,,Odpady,,,,,,,,,,,,,,EVVO ve výuce,,,10 min,Uvnitř,,1,2,ivot_mikrotenov_taky.pdf,odpady_karty_igelitka_pl.pdf,,2020-01-08 22:16:50,public,,,194.228.11.48,1,1,https://petra2018.wufoo.com/cabinet/b39ec669-ab47-4e2e-bec2-356fe50f5237
165,Odpady,Plasty,Markéta Pézlová,Třídění plastu,Žák správně třídí plasty.,,,"Jednoduchá aktivita pro menší děti, které nemají s tříděním ještě tolik zkušeností.",MŠ,První stupeň ZŠ,,,MŠ,1. třída ZŠ,2. třída ZŠ,3. třída ZŠ,,,,,,,,,,,,,ekologie,,,prvouka,,,,,Odpady,,,,,,,,,,,,,,EVVO ve výuce,,,10 min,Uvnitř,,1,2,tdn_plastu.pdf, ,,2020-01-08 22:40:05,public,,,194.228.11.48,1,1,https://petra2018.wufoo.com/cabinet/55b408f4-a122-41be-9111-0aa05cb7a278
166,Odpady,Plasty,Markéta Pézlová,Proč končí plasty v koši?,Žáci provádí jednoduchý průzkum.,,,Žáci během týdne monitorují vyhazované plasty. Ze svých zjištění vyvozují závěry a navrhují řešení.,,První stupeň ZŠ,Druhý stupeň ZŠ,SŠ,,,,3. třída ZŠ,4. třída ZŠ,5. třída ZŠ,6. třída ZŠ,7. třída ZŠ,8. třída ZŠ,9. třída ZŠ,SŠ,,,,přírodopis,,ekologie,,,prvouka,,přírodověda,,,Odpady,,,,,,,,,,,,,Monitoring,EVVO ve výuce,,,projekt,Uvnitř,,1,3,pro_kon_plasty_v_koi_.pdf, ,,2020-01-08 22:48:05,public,,,194.228.11.48,1,1,https://petra2018.wufoo.com/cabinet/9d0f3e4d-b505-4e5c-ad7c-659a099320fa
167,Odpady,Plasty,Markéta Pézlová,Recyklace v regionu,Žáci vyhledají regionálního zpracovatele plastového odpadu.,,,"Žáci pomocí dostupných zdrojů vyhledají, zda se v jejich regionu nachází firma, která se zabývá recyklací plastu, aby od ní získali další informace o recyklaci.  ",,,Druhý stupeň ZŠ,SŠ,,,,,,,6. třída ZŠ,7. třída ZŠ,8. třída ZŠ,9. třída ZŠ,SŠ,,,,přírodopis,,ekologie,občanská výchova,,,,,,,Odpady,,,,,,,,,,,,,,EVVO ve výuce,,,45 min,Uvnitř,,1,1,recyklace_v_regionu.pdf, ,,2020-01-08 23:23:39,public,,,194.228.11.48,1,1,https://petra2018.wufoo.com/cabinet/175ff53d-7aa7-4e37-9579-c0648185d844
168,Odpady,Plasty,Markéta Pézlová,Plasty,Žák se seznámí se základními fakty o plastech.,Žák si uvědomí problémy spojené s plasty a jejich vzrůstající spotřebou.,"Žák vyjmenuje několik způsobů, jak spotřebu plastů snižovat.",Aktivity se zaměřují na snižování spotřeby a pochopení výrobního a recyklačního procesu. ,,První stupeň ZŠ,Druhý stupeň ZŠ,SŠ,,,,3. třída ZŠ,4. třída ZŠ,5. třída ZŠ,6. třída ZŠ,7. třída ZŠ,8. třída ZŠ,9. třída ZŠ,SŠ,,,,přírodopis,,ekologie,občanská výchova,chemie,prvouka,,přírodověda,,,Odpady,,,,,,,,,,,,,,EVVO ve výuce,,,90 min,Uvnitř,,1,2,plasty_metodika.pdf, ,,2020-01-08 23:30:46,public,,,194.228.11.48,1,1,https://petra2018.wufoo.com/cabinet/65777e57-8722-4236-ba17-df5109e7668d
169,Odpady,Recyklace,Markéta Pézlová,Odpadové domino,Žák správně třídí odpad podle druhu materiálu.,,,"Kartičky ke hře domino, které nabízí více variant použití.",,První stupeň ZŠ,Druhý stupeň ZŠ,,,,2. třída ZŠ,3. třída ZŠ,4. třída ZŠ,5. třída ZŠ,6. třída ZŠ,7. třída ZŠ,8. třída ZŠ,9. třída ZŠ,,,,,přírodopis,,ekologie,,,prvouka,,přírodověda,,,Odpady,,,,,,,,,,,,,,EVVO ve výuce,,,10 min,Uvnitř,,1,2,odpadov_domino_1.pdf,odpady_druhy_materil_pl.pdf,,2020-01-09 13:02:08,public,,,194.228.11.51,1,1,https://petra2018.wufoo.com/cabinet/10f5a0ff-4d63-4d7d-9b09-a34acc283ac4
170,Odpady,Recyklace,Markéta Pézlová,Společné třídění,Žák správně třídí odpady podle druhu materiálu.,,,Jednoduchá rychlá pohybová hra o třídění odpadu. ,MŠ,První stupeň ZŠ,,,MŠ,1. třída ZŠ,2. třída ZŠ,3. třída ZŠ,4. třída ZŠ,5. třída ZŠ,,,,,,,,,,,ekologie,,,prvouka,,přírodověda,,,Odpady,,,,,,,,,,,,,,EVVO ve výuce,,,10 min,Uvnitř,Venku,1,3,spolen_tdn.pdf, ,,2020-01-09 13:08:00,public,,,194.228.11.51,1,1,https://petra2018.wufoo.com/cabinet/1c824119-a81b-4df4-98f1-faefceb8232c
171,Odpady,Recyklace,Markéta Pézlová,Otázky o odpadech,Žák si upevní své znalosti o recyklaci a třídění odpadu.,,,"Soubor 12 otázek s odpověďmi na téma recyklace, které lze využít k různým hrám či opakování.",,První stupeň ZŠ,Druhý stupeň ZŠ,,,,,3. třída ZŠ,4. třída ZŠ,5. třída ZŠ,6. třída ZŠ,7. třída ZŠ,8. třída ZŠ,9. třída ZŠ,,,,,přírodopis,,ekologie,,,prvouka,,přírodověda,,,Odpady,,,,,,,,,,,,,,EVVO ve výuce,,,10 min,Uvnitř,,1,1,otzky_o_odpadech.pdf, ,,2020-01-09 13:33:58,public,,,194.228.11.51,1,1,https://petra2018.wufoo.com/cabinet/986bd738-b28d-4a80-a0b2-ae1b35a773ab
172,Odpady,Papír,Markéta Pézlová,Výroba papíru,Žáci se seznámí s průmyslovou výrobou papíru a její energetickou a surovinovou náročností. ,,,Žáci jsou uvedeni do situace po nejmenované katastrofě a ve skupině navrhují stroj na výrobu papíru. Na základě toho si uvědomí surovinovou i energetickou náročnost takové výroby.,,,Druhý stupeň ZŠ,SŠ,,,,,,,6. třída ZŠ,7. třída ZŠ,8. třída ZŠ,9. třída ZŠ,SŠ,,,biologie,přírodopis,,ekologie,,,,,,,,Odpady,Energie,,,,Šetrný spotřebitel,,,,,,,,,EVVO ve výuce,,,30 min,Uvnitř,,1,2,prmyslov_vroba_papru.pdf, ,,2020-01-09 20:51:53,public,2020-01-10 19:10:26,petra2018,194.228.11.51,1,1,https://petra2018.wufoo.com/cabinet/cce9a631-bdb8-4528-9918-c7e1d20b46b2
173,Odpady,Papír,Markéta Pézlová,Šetříme papírem,Žák navrhne jednoduchá opatření pro šetření papírem v rámci školy.,,,Jak ve škole šetřit papírem? Navrhněte s žáky jednoduchá opatření. Materiál nabízí rovnou také několik možných řešení.,,První stupeň ZŠ,Druhý stupeň ZŠ,SŠ,,1. třída ZŠ,2. třída ZŠ,3. třída ZŠ,4. třída ZŠ,5. třída ZŠ,6. třída ZŠ,7. třída ZŠ,8. třída ZŠ,9. třída ZŠ,SŠ,,,,přírodopis,,ekologie,,,prvouka,,přírodověda,,,Odpady,,,,,,,,,,,,,,EVVO ve výuce,,,10 min,Uvnitř,,1,1,etme_paprem_1.pdf, ,,2020-01-09 21:45:38,public,,,194.228.11.51,1,1,https://petra2018.wufoo.com/cabinet/1bd52134-2695-4c16-b000-4038e1562ba7
174,Odpady,Vermikompostování,Markéta Pézlová,Vermikompostování - projekt pro 1. stupeň,"Seznámit žáky s jednou možností kompostování - vermikompostováním. Na tomto příkladu ukázat, jakým způsobem se mění bioodpad na úrodnou půdu.",,,"Praktický projekt, kde se žáci o vermikompostování dozvědí vše potřebné a mohou si vyrobit/založit vlastní vermikompostér. Součástí je také pracovní list.",,První stupeň ZŠ,,,,1. třída ZŠ,2. třída ZŠ,3. třída ZŠ,4. třída ZŠ,5. třída ZŠ,,,,,,,,,,,,,,prvouka,,přírodověda,,,Odpady,,,,,,,,,,,,,,EVVO ve výuce,,,projekt,Uvnitř,Venku,1,4,vermikompostovn__projekt_pro_1._stupe.pdf,vermikompostovani_pl.pdf,,2020-01-09 23:59:45,public,,,194.228.11.51,1,1,https://petra2018.wufoo.com/cabinet/4bb21a5a-cc5d-4806-bf63-074b0af63c47
175,Odpady,Vermikompostování,Markéta Pézlová,Vermikompostování - projekt pro 2. stupeň,"Seznámit žáky s jednou možností kompostování – vermikompostováním. Na tomto příkladu ukázat, jakým způsobem se bioodpad mění zpět na úrodný humus. ",,,Praktický meziooborový projekt. Žáci se dozvědí vše potřebné o vermikompostování a mohou si vyrobit/založit vlastní vermikompostér. Součástí je také pracovní list v angličtině. ,,,Druhý stupeň ZŠ,SŠ,,,,,,,,7. třída ZŠ,8. třída ZŠ,9. třída ZŠ,SŠ,,,biologie,přírodopis,jazyky,ekologie,,,,,,,,Odpady,,,,,,,,,,,,,,EVVO ve výuce,,,projekt,Uvnitř,Venku,1,4,vermikompostovn__projekt_pro_2._stupe.pdf,vermikomposting_pl.pdf,,2020-01-10 00:26:01,public,,,194.228.11.51,1,1,https://petra2018.wufoo.com/cabinet/25156696-6f45-4ea2-a448-f82ced057290
176,Odpady,Vermikompostování,Markéta Pézlová,Vermicomposting,Žáci se seznámí se základními informacemi o výhodách vermikompostování.,Žáci porozumí textu v anglickém jazyce.,Žáci se seznámí se slovní zásobou o vermikompostování.,"Pracovní list o vermikompostování v angličtině. Obsahuje informační text, návod k výrobě vermikompostéru, přehled slovíček k tématu a rovněž otázky pro konverzaci.",,,Druhý stupeň ZŠ,SŠ,,,,,,,,7. třída ZŠ,8. třída ZŠ,9. třída ZŠ,SŠ,,,,,jazyky,ekologie,,,,,,,,Odpady,,,,,,,,,,,,,,EVVO ve výuce,,,45 min,Uvnitř,,1,1,vermikomposting_pl.pdf,vermicomposting__een.pdf,,2020-01-10 01:11:32,public,,,194.228.11.51,1,1,https://petra2018.wufoo.com/cabinet/637e77ac-d562-4e94-bbde-ede297f68135
177,Odpady,Vermikompostování,Markéta Pézlová,Co žížaly baští,Žák označí vhodnou potravu pro žížaly ve vermikompostéru.,,,Jednoduchý obrázkový pracovní list. ,MŠ,První stupeň ZŠ,,,MŠ,1. třída ZŠ,2. třída ZŠ,3. třída ZŠ,,,,,,,,,,,,,ekologie,,,prvouka,,,,,Odpady,,,,,,,,,,,,,,EVVO ve výuce,,,10 min,Uvnitř,,1,1,co_aly_bat.pdf, ,,2020-01-10 01:31:44,public,,,194.228.11.51,1,1,https://petra2018.wufoo.com/cabinet/16d51ee6-2a16-4c8f-80a9-eaf788412b85
178,Odpady,Vermikompostování,Markéta Pézlová,Uživíme žížaly?,"Na základě pozorování a výpočtu žáci určí, jak velkou plochu žížaliště budou potřebovat.",Žák provádí jednoduché pozorování.,,"Plánujete založit ve škole vermikompostér? Spočítejte si, kolik žížal bioodpadem uživíte.",,První stupeň ZŠ,Druhý stupeň ZŠ,SŠ,,,,,4. třída ZŠ,5. třída ZŠ,6. třída ZŠ,7. třída ZŠ,8. třída ZŠ,9. třída ZŠ,SŠ,,matematika,biologie,přírodopis,,ekologie,,,,,přírodověda,,,Odpady,,,,,,,,,,,,,,EVVO ve výuce,,,projekt,Uvnitř,,1,3,uivme_aly_.pdf, ,,2020-01-10 01:39:29,public,,,194.228.11.51,1,1,https://petra2018.wufoo.com/cabinet/59f9e4f6-1425-4584-b6bf-aeca88e41754
179,Voda,Kolik vody je nám třeba,Andrea Tláskalová,Kolik vody je nám třeba - 1. stupeň,"Pomoci žákům uvědomit si, jak velká je naše každodenní spotřeba vody a kde všude se voda spotřebovává, aniž o tom víme. Vést žáky k vědomí omezenosti vodních zdrojů a motivovat je ke snížení spotřeby vody.",,,"Aktivita má žákům pomoci, aby si dokázali lépe představit, kolik vody denně doma spotřebují. Aktivitu je vhodné žákům zadat 1–2 dny před samotným vyplňováním pracovního listu. Jejich úkolem bude nejdříve doma pozorně sledovat, kolik vody se spotřebovává na různé činnosti. Mohou sledovat jak spotřebu svoji vlastní, tak ostatních členů rodiny ",,První stupeň ZŠ,,,,,,3. třída ZŠ,4. třída ZŠ,5. třída ZŠ,,,,,,,matematika,,,,,,,prvouka,,přírodověda,,,,,Voda,,,,,,,,,Analýza,,,EVVO ve výuce,,,projekt,Uvnitř,,1,1,kolik_vody_je_nm_teba_1._stupe.pdf,kolik_vody_je_nm_teba_pl.pdf,,2020-01-12 15:26:09,public,,,78.80.24.109,1,1,https://petra2018.wufoo.com/cabinet/0087b893-5fda-4a83-bb1d-266dedf8c0b9
180,Voda,Kolik vody je nám třeba,Andrea Tláskalová,Kolik vody je nám třeba - 2. stupeň,"Pomoci žákům uvědomit si, jak velká je naše každodenní spotřeba vody a kde všude se voda spotřebovává, aniž o tom víme. Vést žáky k vědomí omezenosti vodních zdrojů a motivovat je ke snížení spotřeby vody.",Žák v praxi odhaduje a měří spotřebu vody.,,"Aktivita má žákům pomoci, aby si dokázali lépe představit, kolik vody denně doma spotřebují. Aktivitu je vhodné žákům zadat 1–2 dny před samotným vyplňováním pracovního listu. Jejich úkolem bude nejdříve doma pozorně sledovat, kolikvody se spotřebovává na různé činnosti. Mohou sledovat jak spotřebu svoji vlastní, tak ostatních členů rodiny.",,,Druhý stupeň ZŠ,,,,,,,,6. třída ZŠ,7. třída ZŠ,8. třída ZŠ,9. třída ZŠ,,,matematika,,,,ekologie,občanská výchova,,,,přírodověda,,,,,Voda,,,,,,,,,Analýza,,,EVVO ve výuce,,,projekt,Uvnitř,,1,2,kolik_vody_je_nm_teba_metodika__2._stupe.pdf,kolik_vody_je_nm_teba_pl_2._stupe.pdf,,2020-01-12 15:37:23,public,,,78.80.24.109,1,1,https://petra2018.wufoo.com/cabinet/8747383c-841d-4413-b19b-8fa865635524
181,Voda,Kudy teče voda ,Andrea Tláskalová,Kudy teče voda - 1.supeň,"Seznámit žáky s problematikou úpravy pitné vody. Žáci si uvědomí, že cesta vody do kohoutku i z něj je velmi komplikovaná.",,,"Žáci si uvědomí, že cesta vody do kohoutku i z něj je velmi komplikovaná. Žáci si zábavnou formou přiblíží cestu vody.",,První stupeň ZŠ,,,,,,3. třída ZŠ,4. třída ZŠ,5. třída ZŠ,,,,,,,,,,,,,,prvouka,,přírodověda,,,,,Voda,,,,,,,,,,,,EVVO ve výuce,,,45 min,Uvnitř,,1,1,kudy_tee__metodika_1._stupe.pdf,kudy_tece_pl_1._stupe.pdf,,2020-01-12 15:59:10,public,,,78.80.24.109,1,1,https://petra2018.wufoo.com/cabinet/c11f01c8-bc71-4b01-ab2f-147c34915e0c
182,Voda,Kudy teče voda,Andrea Tláskalová,Kudy teče voda - 2. stupeň,Seznámit žáky s problematikou čištění odpadní vody. ,,,"Žáci si uvědomí, že cesta vody zpět je poměrně komplikovaná. Jsou schopni navrhnout, jakými opatřeními lze ovlivnit kvalitu vody vypouštěné do kanalizace.",,,Druhý stupeň ZŠ,,,,,,,,,,8. třída ZŠ,9. třída ZŠ,,,,,přírodopis,,ekologie,občanská výchova,chemie,,,,,,,,Voda,,,,,,,,,,,,EVVO ve výuce,,,30 min,Uvnitř,,1,1,kudy_tee__metodika_2._stupe.pdf,kudy_tece_pl_2._stupe.pdf,,2020-01-12 16:16:16,public,,,78.80.24.109,1,1,https://petra2018.wufoo.com/cabinet/fbc53ded-eda2-43af-966d-9014a7611cc0
183,Voda,Kudy teče voda,Andrea Tláskalová,Kudy teče voda - k nám a zpět,Seznámit žáky s problematikou úpravy pitné vody. ,Seznámit žáky s problematikou čištění odpadní vody. ,,"Žáci si uvědomí, že cesta vody do kohoutku i z něj je velmi komplikovaná. Žáci si uvědomí, že cesta vody zpět je poměrně komplikovaná. Jsou schopni navrhnout, jakými opatřeními lze ovlivnit kvalitu vody vypouštěné do kanalizace.",,,Druhý stupeň ZŠ,,,,,,,,,,8. třída ZŠ,9. třída ZŠ,,,,,přírodopis,,ekologie,,chemie,,,,,,,,Voda,,,,,,,,,,,,EVVO ve výuce,,,45 min,Uvnitř,,1,1,kudy_tee__k_nm_a_zpt__metodika.pdf,kudy_tece_pl_k_nm_a_zpt.pdf,,2020-01-12 16:27:09,public,,,78.80.24.109,1,1,https://petra2018.wufoo.com/cabinet/fd363246-99cc-4969-992a-fc2f269a5960
184,Voda,"Pijme vodu, pijme pitnou vodu",Andrea Tláskalová,"Pijme vodu, pijme pitnou vodu - jak nám chutná","Seznámit žáky s pitnou vodou nejen jako pojmem, ale také v souvislosti s pitným režimem.",Porovnat pitnou vodu balenou s vodou z vodovodní sítě a posoudit rozdíly.,,"Žáci si nejdříve zkusí vyplnit svoji představu o pitném režimu. Diskutujte se žáky o tom, co by měli pít a v jakém množství. Poté uspořádejte ve škole ochutnávku vody.",,První stupeň ZŠ,,,,,2. třída ZŠ,3. třída ZŠ,4. třída ZŠ,5. třída ZŠ,,,,,,čeština,,,,,,,,prvouka,,přírodověda,,,,,Voda,,,,,,,,,,,,EVVO ve výuce,,,30 min,Uvnitř,,1,1,pijeme_vodu___metodika_jak_nm_chutn.pdf,pijeme_vodu_pl__jak_nm_chutn.pdf,,2020-01-12 16:43:50,public,,,78.80.24.109,1,1,https://petra2018.wufoo.com/cabinet/c501d461-9885-446b-9c0c-9de5fee5217e
185,Voda,"Pijme vodu, pijme pitnou vodu",Andrea Tláskalová,"Pijme vodu, pijme pitnou vodu - voda je vzácná","Seznámit žáky s pitnou vodou nejen jako pojmem, ale vést žáky k pochopení významu pitné vody. ","Žáci si uvědomí, že cesta vody ze zdroje ke spotřebiteli není přímá a jednoduchá. Budou umět porovnat náš dostatek s problémy třetího světa.",,"Aktivita je pojata jako akční pohybová hra. Před zahájením hry necháme žákům přečíst krátký úryvek s informacemi o dostupnosti vody v rozvojových zemích (viz pracovní list). Vybídneme je, aby si představili, že se nyní ocitnou v jedné z rozvojových zemí, kde je problém s pitnou vodou. Žáky rozdělímedo skupin, každá z nich si vylosuje jednu zemi a zjistí, jakou mají průměrnou denní spotřebu vody na osobu.",,,Druhý stupeň ZŠ,,,,,,,,6. třída ZŠ,7. třída ZŠ,8. třída ZŠ,9. třída ZŠ,,,,,přírodopis,,ekologie,občanská výchova,,,,,,zeměpis,,,Voda,,,,,,,,,,,,EVVO ve výuce,,,45 min,Uvnitř,,1,1,pijeme_vodu___metodika_voda_je_vzcn.pdf,pijeme_vodu_plvoda_je_vzcn.pdf,,2020-01-12 16:50:27,public,,,78.80.24.109,1,1,https://petra2018.wufoo.com/cabinet/5005b5c3-683a-472c-a04e-459a9a4f159a
